photo_file,v24_background_colors,v24_skin_color,v24_floor_colors,v24_waistband,v24_wb_conf_pct,v24_shorts_colors,v24_hem_y_pct,brock_background_ok,brock_skin_ok,brock_floor_ok,brock_waistband,brock_shorts,brock_archetype,brock_brand,brock_notes
jrnats25_A_4_Michael_Torrez.jpg,black / white / brown / coral / royal blue,"gold rgb(186, 106, 71)",brown / black / gray,coral,59.0,white(0.37) + tan/bone(0.33) + coral(0.27),66.8,Ok,Ok,Ok,Coral,Coral/White,Solid,Fied,"Solid Coral to an angle between the legs, this pattern matches front to back, the rest is white with a slight yellow weave pattern between the coral to white."
jrnats26_E_4_Brett_Brown.jpg,black / royal blue / white / navy / gray,"brown rgb(119, 65, 30)",brown / charcoal / tan/bone,charcoal,37.0,charcoal(0.33) + coral(0.32) + tan/bone(0.25) + white(0.1),78.0,Ok,Ok,Ok,Black,Black/Yellow/brown,Pattern + Pattern,Manifest,Solid Black. Symmetrical Gold Maze Pattern over both legs over a faint leopard pattern. 
noram25_F_4_Mika_Edwards.jpg,brown / black / lavender / navy / gray,"brown rgb(139, 68, 32)",gold / charcoal / tan/bone,UNREADABLE,0.0,white(0.6) + tan/bone(0.21) + gray(0.17),63.6,Ok,Ok,Ok,Green,Green/White,Color Gradient + Block,Chula,"Dark Green to white gradient. White lines on the side, dark green bands on one leg."
jrusa25_D_2_Enjley_Cineus.jpg,light blue / charcoal / white / tan/bone / brown,"brown rgb(134, 73, 34)",gray / tan/bone / gold,coral,43.0,white(0.62) + purple(0.19) + tan/bone(0.15),63.6,Ok,Ok,Ok,Coral,Coral/White,Solid + Block,Manifest,"Coral Waistband with coral bands around one leg, black band shadowing the one coral band going into white pant leg. Other side has coral band."
jrnats25_G_1_Jasper_Johnson.jpg,black / white / brown / coral / royal blue,"brown rgb(128, 53, 22)",brown / black / gray,charcoal,42.0,tan/bone(0.44) + coral(0.25) + charcoal(0.24),59.6,Ok,Ok,Ok,Black,Black/Pink/Baby-Blue,Pattern + Block,Manifest,Black with a subtle shadow of a palm tree. One leg has a baby blue band with a pink band shadow into black pant leg
jrusa25_B_1_Paulo_Campagnaro.jpg,light blue / charcoal / white / tan/bone / brown,"brown rgb(158, 76, 20)",gray / tan/bone / gold,coral,48.0,coral(0.4) + purple(0.34) + maroon(0.14) + pink(0.12),61.2,Ok,Ok,Ok,Black,Black/Red,Pattern,Fied,Black band into wavy red with black accents. 
jrnats26_G_2_Carlos_Grullon.jpg,black / royal blue / white / navy / gray,"brown rgb(167, 94, 55)",brown / charcoal / tan/bone,charcoal,45.0,charcoal(0.61) + coral(0.24),62.800000000000004,Ok,Ok,Ok,Black,Black/Red,Pattern,Brotherhood,"Black with Red pattern, reminding of jungle type pattern."
nats25_A_1_Damante_Watson.jpg,charcoal / royal blue / black / lavender,"brown rgb(145, 83, 52)",charcoal / gold / gray,gray,40.0,lavender(0.37) + white(0.32) + tan/bone(0.17) + charcoal(0.13),46.800000000000004,Ok,Ok,Ok,Black,Black/Red,Pattern,Brotherhood,Black with Red cloudy pattern.
jrusa25_B_4_Ronald_Procopio.jpg,light blue / charcoal / white / tan/bone / brown,"red rgb(171, 86, 37)",gray / tan/bone / gold,black,36.0,purple(0.32) + tan/bone(0.3) + charcoal(0.22) + gray(0.16),62.0,Ok,Ok,Ok,Black,Black/Green/White,Pattern,Chula,Black waistband with black and green striped pattern below waistband into legs.
